{
  "artifactSchema": "urn:uuid:85293782-58f5-4c69-aa5b-830dd8aa480d",
  "protocolRelease": "ghostbridge/e1.r0-draft.1",
  "registryClass": "gb.registry.source-claim-authority",
  "sourceClaimAuthorityArtifact": "urn:uuid:053c83e9-617f-4e59-93bf-da9159241d92",
  "claimSemantics": {
    "R": "required-when-source-instance-and-dimension-are-applicable",
    "P": "permitted-optional-claim",
    "optionalAbsence": "no-claim",
    "unlistedSource": "unauthorized-no-authority",
    "omissionDefault": false,
    "absenceAsDenial": false,
    "wildcard": false,
    "inheritance": false,
    "coercion": false,
    "atomicBySemanticDimension": true,
    "bindingIsClaimAuthority": false,
    "derivedValueIsSourceClaim": false
  },
  "dimensions": [
    {
      "id": "agent-identity",
      "label": "Agent identity",
      "authorizedClaims": [
        {
          "source": "Passport/immutable manifest",
          "presence": "R",
          "qualification": "none"
        }
      ]
    },
    {
      "id": "passport-identity",
      "label": "Passport identity",
      "authorizedClaims": [
        {
          "source": "Passport",
          "presence": "R",
          "qualification": "none"
        }
      ]
    },
    {
      "id": "passport-version",
      "label": "Passport version",
      "authorizedClaims": [
        {
          "source": "Passport",
          "presence": "R",
          "qualification": "none"
        }
      ]
    },
    {
      "id": "passport-issuer-identity",
      "label": "Passport issuer identity",
      "authorizedClaims": [
        {
          "source": "Passport",
          "presence": "R",
          "qualification": "none"
        }
      ]
    },
    {
      "id": "grant-issuer-identity",
      "label": "Grant issuer identity",
      "authorizedClaims": [
        {
          "source": "Install Grant",
          "presence": "R",
          "qualification": "none"
        }
      ]
    },
    {
      "id": "client-host-participant-supported-release-set",
      "label": "Client/Host participant supported-release set",
      "authorizedClaims": [
        {
          "source": "Client participant metadata",
          "presence": "R",
          "qualification": "none"
        }
      ]
    },
    {
      "id": "client-host-local-preferred-release",
      "label": "Client/Host local preferred release",
      "authorizedClaims": [
        {
          "source": "Client participant metadata",
          "presence": "R",
          "qualification": "canonical-input consistency claim; non-authorizing; non-ranking; non-selection-channel; cannot force bilateral selection"
        }
      ]
    },
    {
      "id": "agent-participant-supported-release-set",
      "label": "Agent participant supported-release set",
      "authorizedClaims": [
        {
          "source": "Agent participant metadata",
          "presence": "R",
          "qualification": "none"
        }
      ]
    },
    {
      "id": "agent-local-preferred-release",
      "label": "Agent local preferred release",
      "authorizedClaims": [
        {
          "source": "Agent participant metadata",
          "presence": "R",
          "qualification": "canonical-input consistency claim; non-authorizing; non-ranking; non-selection-channel; cannot force bilateral selection"
        }
      ]
    },
    {
      "id": "current-deployed-release-availability",
      "label": "Current deployed release availability",
      "authorizedClaims": [
        {
          "source": "Discovery",
          "presence": "R",
          "qualification": "none"
        }
      ]
    },
    {
      "id": "offer-release-bound",
      "label": "Offer release bound",
      "authorizedClaims": [
        {
          "source": "Offer",
          "presence": "P",
          "qualification": "only where the accepted Offer contract carries it"
        }
      ]
    },
    {
      "id": "grant-release-bound",
      "label": "Grant release bound",
      "authorizedClaims": [
        {
          "source": "Grant",
          "presence": "P",
          "qualification": "only where D1 binds that Grant dimension"
        }
      ]
    },
    {
      "id": "consent-envelope-permitted-release-set",
      "label": "Consent-envelope permitted release set",
      "authorizedClaims": [
        {
          "source": "Consent",
          "presence": "R",
          "qualification": "none"
        }
      ]
    },
    {
      "id": "release-policy-status-security-narrowing",
      "label": "Release policy/status/security narrowing",
      "authorizedClaims": [
        {
          "source": "Policy/status/security authority",
          "presence": "P",
          "qualification": "denial or narrowing only"
        }
      ]
    },
    {
      "id": "grant-organization-scope-binding",
      "label": "Grant organization-scope binding",
      "authorizedClaims": [
        {
          "source": "Install Grant",
          "presence": "R",
          "qualification": "where organization scope is applicable; binding is not Organization identity authority"
        }
      ]
    },
    {
      "id": "organization-restriction",
      "label": "Organization restriction",
      "authorizedClaims": [
        {
          "source": "Offer",
          "presence": "P",
          "qualification": "none"
        },
        {
          "source": "Grant",
          "presence": "P",
          "qualification": "none"
        },
        {
          "source": "Host requirement",
          "presence": "P",
          "qualification": "none"
        },
        {
          "source": "Consent",
          "presence": "R",
          "qualification": "none"
        },
        {
          "source": "Policy",
          "presence": "P",
          "qualification": "none"
        }
      ]
    },
    {
      "id": "grant-tagged-workspace-scope-binding",
      "label": "Grant tagged-workspace-scope binding",
      "authorizedClaims": [
        {
          "source": "Install Grant",
          "presence": "R",
          "qualification": "where workspace scope is applicable, including exact tagged explicit absence; binding is not Workspace identity authority"
        }
      ]
    },
    {
      "id": "workspace-restriction",
      "label": "Workspace restriction",
      "authorizedClaims": [
        {
          "source": "Offer",
          "presence": "P",
          "qualification": "none"
        },
        {
          "source": "Grant",
          "presence": "P",
          "qualification": "none"
        },
        {
          "source": "Host requirement",
          "presence": "P",
          "qualification": "none"
        },
        {
          "source": "Consent",
          "presence": "R",
          "qualification": "none"
        },
        {
          "source": "Policy",
          "presence": "P",
          "qualification": "none"
        }
      ]
    },
    {
      "id": "host-participant-identity",
      "label": "Host participant identity",
      "authorizedClaims": [
        {
          "source": "Client/Host participant metadata",
          "presence": "R",
          "qualification": "none"
        }
      ]
    },
    {
      "id": "host-audience-applicability-requirement",
      "label": "Host/audience applicability requirement",
      "authorizedClaims": [
        {
          "source": "Passport/manifest",
          "presence": "P",
          "qualification": "none"
        },
        {
          "source": "Offer",
          "presence": "P",
          "qualification": "none"
        },
        {
          "source": "Grant",
          "presence": "P",
          "qualification": "none"
        },
        {
          "source": "Host",
          "presence": "R",
          "qualification": "where an exact Host binding is required"
        },
        {
          "source": "Consent",
          "presence": "R",
          "qualification": "none"
        },
        {
          "source": "Policy",
          "presence": "P",
          "qualification": "none"
        }
      ]
    },
    {
      "id": "authenticated-principal",
      "label": "Authenticated principal",
      "authorizedClaims": [
        {
          "source": "Bounded selected-profile authentication result",
          "presence": "R",
          "qualification": "no request body or metadata source owns it"
        }
      ]
    },
    {
      "id": "purpose-bound-agent-resource-target",
      "label": "Purpose-bound Agent/resource target",
      "authorizedClaims": [
        {
          "source": "Grant",
          "presence": "R",
          "qualification": "none"
        },
        {
          "source": "Offer",
          "presence": "P",
          "qualification": "none"
        },
        {
          "source": "Host requirement",
          "presence": "P",
          "qualification": "none"
        },
        {
          "source": "Consent",
          "presence": "R",
          "qualification": "none"
        }
      ]
    },
    {
      "id": "network-origin",
      "label": "Network Origin",
      "authorizedClaims": [
        {
          "source": "Discovery",
          "presence": "R",
          "qualification": "transport verification supplies validity, not identity substitution"
        }
      ]
    },
    {
      "id": "profile-identity-support-ceiling",
      "label": "Profile identity support ceiling",
      "authorizedClaims": [
        {
          "source": "Passport/manifest",
          "presence": "R",
          "qualification": "where assigned"
        }
      ]
    },
    {
      "id": "profile-current-deployment-availability",
      "label": "Profile current deployment availability",
      "authorizedClaims": [
        {
          "source": "Discovery",
          "presence": "R",
          "qualification": "where assigned"
        }
      ]
    },
    {
      "id": "offer-profile-subset-restriction",
      "label": "Offer profile subset/restriction",
      "authorizedClaims": [
        {
          "source": "Offer",